{
  "caseId": "live_in_aide_case_no_violation_001",
  "policy": {
    "privacy_mode": "explicit_only"
  },
  "assertedFacts": {
    "disabled_tenant": true,
    "needs_live_in_aide": true,
    "medical_verification": true,
    "requested_separate_bedroom": true,
    "approved_aide_in_principle": true,
    "denied_separate_bedroom": true,
    "aide_sleeps_in_living_room": false,
    "night_access_needed": false,
    "works_remotely": false,
    "privacy_loss": false,
    "guest_management_problem": false,
    "dog_isolation_problem": false,
    "undue_burden": false,
    "fundamental_alteration": false
  },
  "acceptedFindings": {
    "disabled_tenant": true,
    "needs_live_in_aide": true,
    "medical_verification": true,
    "requested_separate_bedroom": true,
    "approved_aide_in_principle": true,
    "denied_separate_bedroom": true,
    "aide_sleeps_in_living_room": false,
    "night_access_needed": false,
    "works_remotely": false,
    "privacy_loss": false,
    "guest_management_problem": false,
    "dog_isolation_problem": false,
    "undue_burden": false,
    "fundamental_alteration": false
  },
  "evidence": [
    {
      "id": "evidence:medical_verification",
      "type": "MedicalVerification",
      "supports": [
        "medical_verification",
        "needs_live_in_aide"
      ],
      "status": "accepted",
      "sourceText": "Physician verified need for a live-in aide.",
      "assertedBy": "person:mother",
      "confidence": 0.9
    },
    {
      "id": "evidence:alternative_sleeping_space",
      "type": "HousingLayoutRecord",
      "supports": [
        "aide_sleeps_in_living_room"
      ],
      "status": "accepted",
      "sourceText": "Updated housing layout shows the aide does not sleep in the living room.",
      "assertedBy": "org:ha1",
      "confidence": 0.85
    }
  ],
  "events": [
    {
      "id": "evt:t1",
      "event": "request_accommodation",
      "time": "t1",
      "actors": [
        "person:mother",
        "person:aide",
        "org:ha1"
      ],
      "details": {
        "request": "separate_bedroom_for_aide"
      }
    },
    {
      "id": "evt:t2",
      "event": "submit_medical_verification",
      "time": "t2",
      "actors": [
        "person:mother"
      ],
      "details": {
        "evidenceId": "evidence:medical_verification"
      }
    },
    {
      "id": "evt:t3",
      "event": "approve_aide_in_principle",
      "time": "t3",
      "actors": [
        "org:ha1",
        "person:aide",
        "person:mother"
      ]
    },
    {
      "id": "evt:t4",
      "event": "deny_separate_bedroom",
      "time": "t4",
      "actors": [
        "org:ha1",
        "person:aide"
      ]
    }
  ],
  "authorities": [
    {
      "id": "giebeler",
      "label": "Giebeler v. M&B Associates",
      "kind": "case",
      "jurisdiction": "Ninth Circuit",
      "weight": "binding",
      "citation": "343 F.3d 1143 (9th Cir. 2003)",
      "notes": "Accommodation analysis should remain tied to disability-related housing access and a sufficiently developed factual record.",
      "court": "9th Cir.",
      "year": "2003",
      "pincite": "1155",
      "sourceUrl": "https://law.justia.com/cases/federal/appellate-courts/F3/343/1143/636375/",
      "excerptText": "Giebeler is paraphrased here to emphasize that accommodation analysis should stay connected to disability-related housing access once the relevant facts are established.",
      "excerptKind": "paraphrase",
      "proposition": "Accommodation analysis should stay connected to disability-related housing access."
    },
    {
      "id": "california_mobile_home",
      "label": "United States v. California Mobile Home Park Management Co.",
      "kind": "case",
      "jurisdiction": "Ninth Circuit",
      "weight": "binding",
      "citation": "29 F.3d 1413 (9th Cir. 1994)",
      "notes": "Administrative review should identify the requested accommodation and the factual gaps in the record before the matter hardens into a denial dispute.",
      "court": "9th Cir.",
      "year": "1994",
      "pincite": "1416",
      "sourceUrl": "https://law.justia.com/cases/federal/appellate-courts/F3/29/1413/479940/",
      "excerptText": "California Mobile Home is paraphrased here to support the need for a concrete accommodation record before escalation.",
      "excerptKind": "paraphrase",
      "proposition": "Accommodation disputes should be evaluated against a concrete factual record."
    },
    {
      "id": "mcgary",
      "label": "McGary v. City of Portland",
      "kind": "case",
      "jurisdiction": "Ninth Circuit / Oregon",
      "weight": "binding",
      "citation": "386 F.3d 1259 (9th Cir. 2004)",
      "notes": "Housing-related financial burdens can impair the full use and enjoyment of a dwelling.",
      "court": "9th Cir.",
      "year": "2004",
      "pincite": "1265",
      "sourceUrl": "https://law.justia.com/cases/federal/appellate-courts/F3/386/1259/632471/",
      "excerptText": "The lien the City put on McGary's house prevents the full use and enjoyment of his property.",
      "excerptKind": "verified_quote",
      "proposition": "Housing-related financial burdens can impair the full use and enjoyment of a dwelling."
    },
    {
      "id": "hud_joint_statement",
      "label": "HUD/DOJ Joint Statement on Reasonable Accommodations",
      "kind": "guidance",
      "jurisdiction": "Federal",
      "weight": "guidance",
      "notes": "Equal use and enjoyment requires necessary accommodation changes.",
      "court": "HUD/DOJ",
      "year": "2004",
      "pincite": "Question 1, p. 2",
      "sourceUrl": "https://www.justice.gov/crt/about/hce/joint_statement_ra.pdf",
      "excerptText": "Reasonable accommodations may be necessary to afford a person with a disability equal opportunity to use and enjoy a dwelling.",
      "excerptKind": "verified_quote",
      "proposition": "Equal use and enjoyment may require necessary accommodation changes.",
      "citation": "Joint Statement of the Department of Housing and Urban Development and the Department of Justice, Reasonable Accommodations under the Fair Housing Act (May 2004)"
    },
    {
      "id": "cfr_982_316",
      "label": "24 CFR 982.316",
      "kind": "regulation",
      "jurisdiction": "Federal",
      "weight": "binding",
      "citation": "24 C.F.R. \u00a7 982.316(a)",
      "notes": "Program accessibility requires approval of a live-in aide when the accommodation need is established.",
      "court": "24 C.F.R.",
      "year": "current",
      "pincite": "(a)",
      "sourceUrl": "https://www.law.cornell.edu/cfr/text/24/982.316",
      "excerptText": "The regulation is paraphrased here to support the live-in-aide approval principle while the record is still being completed.",
      "excerptKind": "paraphrase",
      "proposition": "A live-in aide should be approved when the program-accessibility need is established."
    }
  ],
  "notes": "Contrasting fixture where the accepted findings do not establish functional harm or violation."
}
